File_Name,Rule_ID,Level,Match,Description,Groups,MITRE_ID,If_Sid,If_Matched_Sid,Frequency,Timeframe,Ignore
0391-fortigate_rules.xml,44630,3,,FortiGate: IPS - Low severity.,,,44627,,,,
0391-fortigate_rules.xml,44631,5,,FortiGate: IPS - Medium severity.,,,44627,,,,
0392-fortimail_rules.xml,44640,0,,FortiMail Rules.,,,,,,,
0392-fortimail_rules.xml,44641,0,,FortiMail: Informational message.,,,44640,,,,
0392-fortimail_rules.xml,44642,3,,FortiMail: Warning message.,,,44640,,,,
0392-fortimail_rules.xml,44643,5,,FortiMail: Error message.,,,44640,,,,
0392-fortimail_rules.xml,44644,7,,FortiMail: Critical message.,,,44640,,,,
0392-fortimail_rules.xml,44645,10,,FortiMail: Alert message.,,,44640,,,,
0392-fortimail_rules.xml,44646,13,,FortiMail: Emergency message.,,,44640,,,,
0392-fortimail_rules.xml,44647,7,,FortiMail: DNS Record does not match.,,,44640,,,,
0392-fortimail_rules.xml,44648,5,,FortiMail: DNS lookup is not successful.,,,44640,,,,
0392-fortimail_rules.xml,44649,3,,FortiMail: An administrator successfully logged in using the web-based manager or CLI.,,,44641,,,,
0392-fortimail_rules.xml,44650,3,,FortiMail: An administrator from a specified IP address logged into the WebMail.,,,44641,,,,
0392-fortimail_rules.xml,44651,5,,"FortiMail: An administrator failed to log in using the console, SSH, or telnet.",,,44641,,,,
0392-fortimail_rules.xml,44652,3,,"FortiMail: The WebMail GUI cannot display the email message, or the quarantined message in the web-based manager.",,,44641,,,,
0392-fortimail_rules.xml,44653,3,,FortiMail: Specific information in a message cannot be retrieved.,,,44641,,,,
0392-fortimail_rules.xml,44654,3,,FortiMail: The message cannot be read from the mailbox.,,,44641,,,,
0392-fortimail_rules.xml,44655,3,,FortiMail: An unknown failure occurred when trying to prepare the attachment for a user to download.,,,44641,,,,
0392-fortimail_rules.xml,44656,3,,FortiMail: An administrator successfully logged in using the LCD.,,,44641,,,,
0392-fortimail_rules.xml,44657,3,,FortiMail: An administrator failed to log in using the LCD.,,,44641,,,,
0392-fortimail_rules.xml,44658,3,,FortiMail: An administrator changed a system update setting.,,,44641,,,,
0392-fortimail_rules.xml,44659,3,,FortiMail: An administrator changed an interface IP address using the CLI.,,,44641,,,,
0392-fortimail_rules.xml,44660,3,,FortiMail: An administrator changed the status of an interface.,,,44641,,,,
0392-fortimail_rules.xml,44661,3,,FortiMail: An administrator changed DNS settings using the CLI.,,,44641,,,,
0392-fortimail_rules.xml,44662,3,,FortiMail: An administrator changed the default gateway IP address using the web-based manager.,,,44641,,,,
0392-fortimail_rules.xml,44663,3,,FortiMail: An administrator changed a routing configuration.,,,44641,,,,
0392-fortimail_rules.xml,44664,3,,FortiMail: An administrator changed the system time settings.,,,44641,,,,
0392-fortimail_rules.xml,44665,3,,FortiMail: An administrator changed NTP server settings using the CLI or web-based manager.,,,44641,,,,
0392-fortimail_rules.xml,44666,3,,FortiMail: An administrator changed the console settings using the CLI.,,,44641,,,,
0392-fortimail_rules.xml,44667,3,,FortiMail: An administrator changed a timeout value using the CLI.,,,44641,,,,
0392-fortimail_rules.xml,44668,3,,FortiMail: An administrator changed the system language to another language using the CLI or web-based manager.,,,44641,,,,
0392-fortimail_rules.xml,44669,3,,FortiMail: An administrator changed the LCD PIN setting using the CLI or web-based manager.,,,44641,,,,
0392-fortimail_rules.xml,44670,3,,FortiMail: An administrator changed another administrator using the CLI or web-based manager.,,,44641,,,,
0392-fortimail_rules.xml,44671,3,,FortiMail: An administrator changed HA settings using the CLI.,,,44641,,,,
0392-fortimail_rules.xml,44672,3,,FortiMail: An administrator changed the SNMP Settings.,,,44641,,,,
0392-fortimail_rules.xml,44673,3,,FortiMail: An administrator has changed a FortiMail disclaimer Settings.,,,44641,,,,
0392-fortimail_rules.xml,44674,3,,FortiMail: An administrator has modified local domains using the CLI.,,,44641,,,,
0392-fortimail_rules.xml,44675,3,,FortiMail: An administrator has modified a POP3 setting using the CLI.,,,44641,,,,
0392-fortimail_rules.xml,44676,3,,FortiMail: An administrator has modified a relay server name using the CLI.,,,44641,,,,
0392-fortimail_rules.xml,44677,3,,FortiMail: An administrator has modified SMTP Settings.,,,44641,,,,
0392-fortimail_rules.xml,44678,3,,FortiMail: An administrator has modified the email archiving Settings.,,,44641,,,,
0392-fortimail_rules.xml,44679,3,,FortiMail: An administrator has modified a system quarantine setting using the CLI.,,,44641,,,,
0392-fortimail_rules.xml,44680,3,,FortiMail: An administrator has changed mail server settings using the CLI or web-based manager.,,,44641,,,,
0392-fortimail_rules.xml,44681,3,,FortiMail: An administrator set or deleted permission of mail using the CLI or web-based manager.,,,44641,,,,
0392-fortimail_rules.xml,44682,3,,FortiMail: An administrator set or deleted permission of mail using the CLI or web-based manager.,,,44641,,,,
0392-fortimail_rules.xml,44683,3,,FortiMail: An administrator changed a local user using the CL.,,,44641,,,,
0392-fortimail_rules.xml,44684,3,,FortiMail: An administrator changed a user group using the CLI or web-based manager.,,,44641,,,,
0392-fortimail_rules.xml,44685,3,,FortiMail: An administrator changed a mail user using the CLI.,,,44641,,,,
0392-fortimail_rules.xml,44686,3,,FortiMail: An administrator changed a mail server user using the web-based manager.,,,44641,,,,
0392-fortimail_rules.xml,44687,3,,FortiMail: An administrator has modified a IMAP setting using the CLI.,,,44641,,,,
0392-fortimail_rules.xml,44688,3,,FortiMail: An administrator removed an email banned word using the CLI.,,,44641,,,,
0392-fortimail_rules.xml,44689,3,,FortiMail: An administrator changed a log setting using the CLI.,,,44641,,,,
0392-fortimail_rules.xml,44690,3,,FortiMail: An administrator changed an alert email setting using the CLI.,,,44641,,,,
0392-fortimail_rules.xml,44691,3,,FortiMail: DNS query event.,,,,,,,
0392-fortimail_rules.xml,44692,0,,FortiMail: System Event HA (high availability) log messages.,,,44641,,,,
0392-fortimail_rules.xml,44693,3,,FortiMail: The FortiMail unit is entering master mode.,,,44692,,,,
0392-fortimail_rules.xml,44694,3,,FortiMail: The FortiMail unit is entering slave mode.,,,44692,,,,
0392-fortimail_rules.xml,44695,3,,FortiMail: The FortiMail unit is assuming the primary unit role because the retry limit was reached for connecting to the original primary unit.,,,44692,,,,
0392-fortimail_rules.xml,44696,3,,FortiMail: Heartbeat related activities.,,,44692,,,,
0392-fortimail_rules.xml,44697,3,,FortiMail: Synchronization related information.,,,44692,,,,
0392-fortimail_rules.xml,44698,0,,FortiMail: System Event System log messages.,,,,,,,
0392-fortimail_rules.xml,44699,5,,FortiMail: An administrator restarted the system using the CLI or web-based manager.,,,44698,,,,
0392-fortimail_rules.xml,44700,5,,FortiMail: An administrator shut down the system using the CLI or web-based manager.,,,44698,,,,
0392-fortimail_rules.xml,44701,5,,FortiMail: An administrator reloaded the system using the CLI or web-based manager.,,,44698,,,,
0392-fortimail_rules.xml,44702,5,,"FortiMail: An administrator reset the system to factory default using the CLI, web-based manager, or LCD.",,,44698,,,,
0392-fortimail_rules.xml,44703,5,,FortiMail: An administrator upgraded/downgraded system firmware using the CLI or web-based manager.,,,44698,,,,
0392-fortimail_rules.xml,44704,5,,"FortiMail: An administrator upgraded system firmware unsuccessfully using the CLI, console, telnet, or web-based manager.",,,44698,,,,
0392-fortimail_rules.xml,44705,5,,"FortiMail: An administrator or LCD user changed the mode to gateway, server, or transparent mode using the CLI, web-based manager or LCD.",,,44698,,,,
0392-fortimail_rules.xml,44706,3,,FortiMail: The FortiMail unit updated the following FortiGuard services.,,,44642,,,,
0392-fortimail_rules.xml,44707,3,,FortiMail: IMAP-related events.,,,,,,,
0392-fortimail_rules.xml,44708,3,,FortiMail: POP3-related events.,,,,,,,
0392-fortimail_rules.xml,44709,3,,FortiMail: SMTP-related events.,,,"44641,44642,44643,44644,44645,44646",,,,
0392-fortimail_rules.xml,44710,3,,FortiMail: The reporting daemon is starting.,,,44709,,,,
0392-fortimail_rules.xml,44711,3,,FortiMail: The antivirus database is successfully loaded.,,,44709,,,,
0392-fortimail_rules.xml,44712,3,,FortiMail: FortiGuard Antispam Rule (FSAR) Operational Event.,,,44709,,,,
0392-fortimail_rules.xml,44713,3,,FortiMail: Mail aliases have been rebuilt.,,,44709,,,,
0392-fortimail_rules.xml,44714,3,,FortiMail: Updated daemon is restarted to reload default antivirus engine and database.,,,44709,,,,
0392-fortimail_rules.xml,44715,3,,FortiMail: The user successfully uploaded the antivirus database.,,,44709,,,,
0392-fortimail_rules.xml,44716,3,,FortiMail: The FortiMail unit is training a specific bayesian database.,,,44709,,,,
0392-fortimail_rules.xml,44717,3,,FortiMail: Event Webmail log messages.,,,,,,,
0392-fortimail_rules.xml,44718,3,,FortiMail: The file contains the specified virus.,,,44641,,,,
0392-fortimail_rules.xml,44719,3,,FortiMail: SPAM-related events.,,,44641,,,,
0392-fortimail_rules.xml,44720,3,,FortiMail: FortiMail encrypted or decrypted an email.,,,44641,,,,
0392-fortimail_rules.xml,44721,3,,FortiMail: Virus related events.,,,"44642,44643,44644,44645,44646",,,,
0393-fortiauth_rules.xml,44730,0,,Alert from Forti Authenticator.,,,,,,,
0393-fortiauth_rules.xml,44731,0,,FortiAuth: Authentication event.,"gpg13_3.3,gpg13_7.1,hipaa_164.312.a.1,nist_800_53_AC.7,nist_800_53_SC.5,pci_dss_1.3.2,pci_dss_6.5.10,pci_dss_7.1,pci_dss_8.1,tsc_cc6.1,",T1102,44730,,,,
0393-fortiauth_rules.xml,44732,4,,FortiAuth: Authentication pending by user $(dstuser).,,,44731,,,,
0393-fortiauth_rules.xml,44733,7,,FortiAuth: Authentication failed by user $(dstuser).,"gpg13_3.3,hipaa_164.312.e.1,nist_800_53_AC.7,pci_dss_8.2",T1102,44731,,,,
0393-fortiauth_rules.xml,44734,3,,FortiAuth: Authentication success by user $(dstuser).,"hipaa_164.312.d,pci_dss_8.2",,44731,,,,
0393-fortiauth_rules.xml,44735,4,,FortiAuth: System event.,,,44730,,,,
0395-hp_rules.xml,81700,0,,HP 5500 EI messages grouped.,,,,,,,
0395-hp_rules.xml,81701,7,,HP 5500 EI - Emergency event,"hp-emergency,gdpr_IV_35.7.d,",,81700,,,,
0395-hp_rules.xml,81702,6,,HP 5500 EI - Alert event,"hp-alert,",,81700,,,,
0395-hp_rules.xml,81703,5,,HP 5500 EI - Critical event,"hp-critical,",,81700,,,,
0395-hp_rules.xml,81704,4,,HP 5500 EI - Error event,"hp-error,",,81700,,,,
0395-hp_rules.xml,81705,3,,HP 5500 EI - Warning event,"hp-warning,",,81700,,,,
0395-hp_rules.xml,81706,1,,HP 5500 EI - Notification event,"hp-notification,",,81700,,,,
0395-hp_rules.xml,81707,0,,HP 5500 EI - Informational event,"hp-informational,",,81700,,,,
0395-hp_rules.xml,81708,0,,HP 5500 EI - Debug event,"hp-debug,",,81700,,,,
0395-hp_rules.xml,81709,4,failed to log in|failed to login|authentication failed|Authentication is failed,HP 5500 EI - Warning event: Authentication failure,"authentication_failed,pci_dss_10.2.4,pci_dss_10.2.5,gpg13_7.1,gdpr_IV_35.7.d,gdpr_IV_32.2,hipaa_164.312.b,nist_800_53_AU.14,nist_800_53_AC.7,tsc_CC6.1,tsc_CC6.8,tsc_CC7.2,tsc_CC7.3,",,81705,,,,
0395-hp_rules.xml,81710,10,,HP 5500 EI: Multiple authentication failures.,"authentication_failures,pci_dss_10.2.4,pci_dss_10.2.5,pci_dss_11.4,gpg13_7.1,gdpr_IV_35.7.d,gdpr_IV_32.2,hipaa_164.312.b,nist_800_53_AU.14,nist_800_53_AC.7,nist_800_53_SI.4,tsc_CC6.1,tsc_CC6.8,tsc_CC7.2,tsc_CC7.3,",T1110,,81709,8,,
0400-openvpn_rules.xml,81800,0,,OpenVPN messages grouped.,,,,,,,
0400-openvpn_rules.xml,81801,3,Peer Connection Initiated with,OpenVPN: User logged in,"authentication_success,pci_dss_10.2.5,gpg13_7.1,gpg13_7.2,gdpr_IV_32.2,hipaa_164.312.b,nist_800_53_AU.14,nist_800_53_AC.7,tsc_CC6.8,tsc_CC7.2,tsc_CC7.3,",T1078,81800,,,,
0400-openvpn_rules.xml,81802,3,,OpenVPN: Concurrent connections,,,,81801,3,60,
0400-openvpn_rules.xml,81803,4,TLS Error|TLS Auth Error,OpenVPN: Connection Certificate Failed,"openvpn-error,gdpr_IV_35.7.d,",T1133,81800,,,,
0400-openvpn_rules.xml,81804,4,,OpenVPN: Certificate failed - Possible revoked user,"openvpn-error,gdpr_IV_35.7.d,gdpr_IV_32.2,",T1133,,81803,3,60,
0400-openvpn_rules.xml,81805,5,^LDAP bind failed:,OpenVPN LDAP Bind Failure: $(ldap_data.error_message),"pci_dss_10.2.5,gpg13_7.1,gpg13_7.2,gdpr_IV_32.2,hipaa_164.312.b,nist_800_53_AU.14,nist_800_53_AC.7",,81800,,,,
0400-openvpn_rules.xml,81806,5,^Incorrect password supplied for LDAP DN,OpenVPN LDAP Logon Failure: $(ldap_data.Username) [$(ldap_data.Department)],"pci_dss_10.2.5,gpg13_7.1,gpg13_7.2,gdpr_IV_32.2,hipaa_164.312.b,nist_800_53_AU.14,nist_800_53_AC.7,",,81800,,,,
0405-rsa-auth-manager_rules.xml,81900,0,,RSA Authentication Manager messages grouped.,,,,,,,
0405-rsa-auth-manager_rules.xml,81901,2,,RSA Authentication Manager: Loging event,,,81900,,,,
0405-rsa-auth-manager_rules.xml,81902,4,,RSA Authentication Manager: Authentication success,"authentication_success,pci_dss_10.2.5,gpg13_7.1,gpg13_7.2,gdpr_IV_32.2,hipaa_164.312.b,nist_800_53_AU.14,nist_800_53_AC.7,tsc_CC6.8,tsc_CC7.2,tsc_CC7.3,",T1078,81901,,,,
0405-rsa-auth-manager_rules.xml,81903,5,,RSA Authentication Manager: Authentication fail,"authentication_failed,pci_dss_10.2.4,pci_dss_10.2.5,gpg13_7.1,gdpr_IV_35.7.d,gdpr_IV_32.2,hipaa_164.312.b,nist_800_53_AU.14,nist_800_53_AC.7,tsc_CC6.1,tsc_CC6.8,tsc_CC7.2,tsc_CC7.3,",,81901,,,,
0405-rsa-auth-manager_rules.xml,81904,10,,RSA Authentication Manager: Multiple authentication failures.,"authentication_failures,pci_dss_10.2.4,pci_dss_10.2.5,pci_dss_11.4,gpg13_7.1,gdpr_IV_35.7.d,gdpr_IV_32.2,hipaa_164.312.b,nist_800_53_AU.14,nist_800_53_AC.7,nist_800_53_SI.4,tsc_CC6.1,tsc_CC6.8,tsc_CC7.2,tsc_CC7.3,",T1110,,81903,8,120,
0410-imperva_rules.xml,82000,0,,Imperva messages grouped.,,,,,,,
0410-imperva_rules.xml,82001,4,,Imperva: Event with high severity,,,82000,,,,
0415-sophos_rules.xml,82100,0,,Sophos alerts.,,,,,,,
0415-sophos_rules.xml,82101,3,Scan 'Sophos Cloud Scheduled Scan' started,Sophos Cloud Scheduled Scan started,,,82100,,,,
0415-sophos_rules.xml,82102,3,Scan 'Sophos Cloud Scheduled Scan' completed,Sophos Cloud Scheduled Scan completed,,,82100,,,,
0415-sophos_rules.xml,82103,3,has started,User has started on-access scanning for this machine.,,,82100,,,,
0415-sophos_rules.xml,82104,3,has stopped,User has stopped on-access scanning for this machine.,,,82100,,,,
0415-sophos_rules.xml,82105,3,detection data version,Sophos database updated,"gpg13_4.4,",,82100,,,,
0415-sophos_rules.xml,64270,0,,savscan category,,,,,,,
0415-sophos_rules.xml,64271,3,,SAVSCAN-DETAILS alert,,,64270,,,,
0415-sophos_rules.xml,64272,6,,NOTIFY_ONDEMANDTHREAT_INFECTED alert,,,64270,,,,
0415-sophos_rules.xml,64273,6,,SCANNER_DIED_KILLED alert,,,64270,,,,
0415-sophos_rules.xml,64274,0,,Update category,,,,,,,
0415-sophos_rules.xml,64275,3,,NO_UPDATED_FROM alert,,,64274,,,,
0420-freeipa_rules.xml,82200,0,,FreeIPA syslog.,,,,,,,
0420-freeipa_rules.xml,82201,0,] ipa:,FreeIPA (apache format),,,30101,,,,
0420-freeipa_rules.xml,82202,0,,FreeIPA messages grouped.,,,"82200,82201",,,,
0420-freeipa_rules.xml,82203,4,Password incorrect,FreeIPA: Authentication fail,"authentication_failed,pci_dss_10.2.4,pci_dss_10.2.5,gpg13_7.1,gdpr_IV_35.7.d,gdpr_IV_32.2,hipaa_164.312.b,nist_800_53_AU.14,nist_800_53_AC.7,tsc_CC6.1,tsc_CC6.8,tsc_CC7.2,tsc_CC7.3,",,82202,,,,
0425-cisco-estreamer_rules.xml,82400,0,,Cisco eStreamer messages grouped.,,,,,,,
0425-cisco-estreamer_rules.xml,82401,5,failed Oracle Mysql login attempt,Cisco eStreamer: SERVER-MYSQL failed login attempt,"authentication_failed,pci_dss_10.2.4,pci_dss_10.2.5,gpg13_7.1,gdpr_IV_35.7.d,gdpr_IV_32.2,hipaa_164.312.b,nist_800_53_AU.14,nist_800_53_AC.7,tsc_CC6.1,tsc_CC6.8,tsc_CC7.2,tsc_CC7.3,",,82400,,,,
0425-cisco-estreamer_rules.xml,82402,5,login attempt from unauthorized location,Cisco eStreamer: SERVER-MYSQL login attempt from unauthorized location,"authentication_failed,pci_dss_10.2.4,pci_dss_10.2.5,gpg13_7.1,gdpr_IV_35.7.d,gdpr_IV_32.2,hipaa_164.312.b,nist_800_53_AU.14,nist_800_53_AC.7,tsc_CC6.1,tsc_CC6.8,tsc_CC7.2,tsc_CC7.3,",,82400,,,,
0425-cisco-estreamer_rules.xml,82403,5,client authentication bypass attempt,Cisco eStreamer: SERVER-MYSQL client authentication bypass attempt,"authentication_failed,pci_dss_10.2.4,pci_dss_10.2.5,gpg13_7.1,gdpr_IV_35.7.d,gdpr_IV_32.2,hipaa_164.312.b,nist_800_53_AU.14,nist_800_53_AC.7,tsc_CC6.1,tsc_CC6.8,tsc_CC7.2,tsc_CC7.3,",,82400,,,,
0425-cisco-estreamer_rules.xml,82404,5,show databases attempt,Cisco eStreamer: SERVER-MYSQL show databases attempt,"gdpr_IV_35.7.d,",,82400,,,,
0425-cisco-estreamer_rules.xml,82405,9,DNS request for potential malware,Cisco eStreamer: APP-DETECT DNS request for potential malware,"pci_dss_10.6.1,gdpr_IV_35.7.d,",T1071.004,82400,,,,
0430-ms_wdefender_rules.xml,83000,0,Microsoft-Windows-Windows Defender/Operational:,Windows Defender messages grouped.,,,18100,,,,
0430-ms_wdefender_rules.xml,83001,12,,Windows Defender: detected potentially unwanted software,"pci_dss_10.6.1,gdpr_IV_35.7.d,",,83000,,,,
0430-ms_wdefender_rules.xml,83002,7,,Windows Defender: taken action to protect machine from unwanted software,"pci_dss_10.6.1,gdpr_IV_35.7.d,",,83000,,,,
0435-ms_logs_rules.xml,83200,5,,MS Logs: The audit log was cleared.,"gpg13_10.1,gdpr_II_5.1.f,gdpr_IV_30.1.g,log_clearing_auditlog,",T1070,18101,,,,
0435-ms_logs_rules.xml,83201,5,,MS Logs: A Windows log file was cleared.,"gpg13_10.1,gdpr_II_5.1.f,log_clearing,",T1070,18101,,,,
0435-ms_logs_rules.xml,83202,5,,The Event log service was started,"windows_log_service_started,gpg13_10.1,",T1543.003,18101,,,,
0440-ms_sqlserver_rules.xml,85000,0,,SQL Server messages.,,,,,,,
0440-ms_sqlserver_rules.xml,85001,3,Starting up database,Starting up database.,,,85000,,,,
0440-ms_sqlserver_rules.xml,85002,3,Attempting to load library,Attempting to load library.,"sqlserverlibraries,",,85000,,,,
0440-ms_sqlserver_rules.xml,85003,3,Server process ID is,SQL Server process ID.,"sqlserver_process_id,",,85000,,,,
0440-ms_sqlserver_rules.xml,85004,5,Login succeeded for user,SQL Server login success.,"sqlserver_login,pci_dss_10.2.5,gpg13_7.1,gpg13_7.2,gdpr_IV_32.2,hipaa_164.312.b,nist_800_53_AU.14,nist_800_53_AC.7,tsc_CC6.8,tsc_CC7.2,tsc_CC7.3,",,85000,,,,
0440-ms_sqlserver_rules.xml,85005,7,Login failed for user,SQL Server login failed.,"sqlserver_login, authentication_failed,pci_dss_10.2.4,pci_dss_10.2.5,gpg13_7.1,gdpr_IV_35.7.d,gdpr_IV_32.2,hipaa_164.312.b,nist_800_53_AU.14,nist_800_53_AC.7,tsc_CC6.1,tsc_CC6.8,tsc_CC7.2,tsc_CC7.3,",,85000,,,,
0440-ms_sqlserver_rules.xml,85006,10,,SQL Server: Multiple authentication failures.,"identityguard_login,authentication_failures,pci_dss_10.2.4,pci_dss_10.2.5,pci_dss_11.4,gpg13_7.1,gdpr_IV_35.7.d,gdpr_IV_32.2,hipaa_164.312.b,nist_800_53_AU.14,nist_800_53_AC.7,nist_800_53_SI.4,tsc_CC6.1,tsc_CC6.8,tsc_CC7.2,tsc_CC7.3,",T1110,,85005,8,,
0440-ms_sqlserver_rules.xml,85007,3,Using ,SQL Server library use.,"sqlserverlibraries,",,85000,,,,
0440-ms_sqlserver_rules.xml,85008,6,The SQL Server Network Interface library could not register the Service Principal Name,SQL Server Network Interface library unregistered ,"sqlservererror, sqlserverlibraries,gdpr_IV_35.7.d,",,85000,,,,
0440-ms_sqlserver_rules.xml,85009,3,Error: ,SQL Server error.,"sqlservererror,gdpr_IV_35.7.d,",,85000,,,,
0440-ms_sqlserver_rules.xml,85010,3,FILESTREAM: ,SQL Server filestream information.,"sqlservererror,",,85000,,,,
0445-identity_guard_rules.xml,85500,0,,Identity Guard Log.,,,,,,,
0445-identity_guard_rules.xml,85501,7,failed authentication,Identity Guard: User authentication failed.,"identityguard_login,authentication_failed,pci_dss_10.2.4,pci_dss_10.2.5,gpg13_7.1,gdpr_IV_35.7.d,gdpr_IV_32.2,hipaa_164.312.b,nist_800_53_AU.14,nist_800_53_AC.7,tsc_CC6.1,tsc_CC6.8,tsc_CC7.2,tsc_CC7.3,",,85500,,,,
0445-identity_guard_rules.xml,85502,10,,Identity Guard: Multiple authentication failures.,"identityguard_login,authentication_failures,pci_dss_10.2.4,pci_dss_10.2.5,pci_dss_11.4,gpg13_7.1,gdpr_IV_35.7.d,gdpr_IV_32.2,hipaa_164.312.b,nist_800_53_AU.14,nist_800_53_AC.7,nist_800_53_SI.4,tsc_CC6.1,tsc_CC6.8,tsc_CC7.2,tsc_CC7.3,",T1110,,85501,8,,
0450-mongodb_rules.xml,85750,0,,MongoDB messages,,,,,,,
0450-mongodb_rules.xml,85751,9,,MongoDB: Fatal message,"gdpr_IV_35.7.d,",,85750,,,,
0450-mongodb_rules.xml,85752,5,,MongoDB: Error message,,,85750,,,,
0450-mongodb_rules.xml,85753,4,,MongoDB: Warning message,,,85750,,,,
0450-mongodb_rules.xml,85754,0,,MongoDB: Debug message,,,85750,,,,
0450-mongodb_rules.xml,85755,3,,MongoDB: Informational message,,,85750,,,,
0450-mongodb_rules.xml,85756,3,connection accepted,MongoDB: Connection accepted,,,85755,,,,
0450-mongodb_rules.xml,85757,3,end connection,MongoDB: End connection,,,85755,,,,
0450-mongodb_rules.xml,85758,3,Successfully authenticated,MongoDB: Successfully authentication,"authentication_success,pci_dss_10.2.5,gpg13_7.1,gpg13_7.2,gdpr_IV_32.2,hipaa_164.312.b,nist_800_53_AU.14,nist_800_53_AC.7,tsc_CC6.8,tsc_CC7.2,tsc_CC7.3,",T1078,85755,,,,
0450-mongodb_rules.xml,85759,4,authentication failed for,MongoDB: Failed authentication,"authentication_failed,pci_dss_10.2.4,pci_dss_10.2.5,gpg13_7.1,gdpr_IV_35.7.d,gdpr_IV_32.2,hipaa_164.312.b,nist_800_53_AU.14,nist_800_53_AC.7,tsc_CC6.1,tsc_CC6.8,tsc_CC7.2,tsc_CC7.3,",,85755,,,,
0450-mongodb_rules.xml,85760,10,,MongoDB: Multiple authentication failures.,"authentication_failures,pci_dss_10.2.4,pci_dss_10.2.5,pci_dss_11.4,gpg13_7.1,gdpr_IV_35.7.d,gdpr_IV_32.2,hipaa_164.312.b,nist_800_53_AU.14,nist_800_53_AC.7,nist_800_53_SI.4,tsc_CC6.1,tsc_CC6.8,tsc_CC7.2,tsc_CC7.3,",T1110,,85759,8,,
0450-mongodb_rules.xml,85761,7,,MongoDB: Execute commands without the necessary privileges,"pci_dss_10.2.5,gdpr_IV_35.7.d,gdpr_IV_32.2,",,85755,,,,
0455-docker_rules.xml,86000,0,,Docker messages,,,,,,,
0455-docker_rules.xml,86001,1,,Docker: Information message,"docker-info,",,86000,,,,
0455-docker_rules.xml,86002,1,,Docker: Warning message,"docker-warning,",,86000,,,,
0455-docker_rules.xml,86003,3,,Docker: Error message,"docker-error,",,86000,,,,
0455-docker_rules.xml,86004,3,,Docker: Fatal message,"docker-fatal,",,86000,,,,
0455-docker_rules.xml,86005,4,unauthorized,Docker: Error - unauthorized action,"docker-error,pci_dss_10.2.4,pci_dss_10.2.5,gdpr_IV_35.7.d,",,86003,,,,
0455-docker_rules.xml,86006,4,denied: User,Docker: Error - denied action,"docker-error,pci_dss_10.2.5,gdpr_IV_35.7.d,gdpr_IV_32.2,",,86003,,,,
0460-jenkins_rules.xml,86250,0,,Jenkins messages,,,,,,,
0460-jenkins_rules.xml,86251,1,,Jenkins: Information message,"jenkins-info,",,86250,,,,
0460-jenkins_rules.xml,86252,1,,Jenkins: Warning message,"jenkins-warn,",,86250,,,,
0460-jenkins_rules.xml,86253,3,,Jenkins: Severe message,"jenkins-severe,",,86250,,,,
0460-jenkins_rules.xml,86254,3,Installation successful:,Jenkins: Installation successful,"jenkins-info,",,86251,,,,
0460-jenkins_rules.xml,86255,3,Started SSHD,Jenkins: Started SSHD,"jenkins-info,",,86251,,,,
0470-vshell_rules.xml,86800,0,VShellSSH2,VShell message grouped.,,,,,,,
0470-vshell_rules.xml,86801,3,Connection accepted from,VShell connection attempt successful,"pci_dss_10.2.5,gdpr_IV_32.2,",,86800,,,,
0470-vshell_rules.xml,86802,5,,VShell user failed to login or user does not exist,"pci_dss_10.2.4,pci_dss_10.2.5,gpg13_7.1,gdpr_IV_35.7.d,gdpr_IV_32.2,",,86800,,,,
0470-vshell_rules.xml,86803,7,,VShell user used the maximum number of password attempts.,"pci_dss_10.2.4,pci_dss_10.2.5,pci_dss_11.4,gpg13_7.1,gdpr_IV_35.7.d,gdpr_IV_32.2,",T1110,86802,,,,
0470-vshell_rules.xml,86804,10,,Host is trying to connect to VShell server but exists in the deny file.,"gdpr_IV_35.7.d,",,86800,,,,
0470-vshell_rules.xml,86805,3,,VShell user successfully authenticated.,"pci_dss_10.2.5,gpg13_7.1,gpg13_7.2,gdpr_IV_32.2,",,86800,,,,
0470-vshell_rules.xml,86806,12,,"VShell multiple connection attempts within 2 minute by a host in the deny file, potential DOS or brute force attempt.","pci_dss_10.2.4,pci_dss_10.2.5,pci_dss_11.4,gdpr_IV_35.7.d,gdpr_IV_32.2,",T1110,,86804,7,120,
0470-vshell_rules.xml,86807,12,,VShell host has exceeded the number of failed login attempts and has been added to the Hosts Deny file.,"pci_dss_10.2.4,pci_dss_10.2.5,pci_dss_11.4,gdpr_IV_35.7.d,gdpr_IV_32.2,",T1110,,86802,7,60,
0475-suricata_rules.xml,86600,0,,Suricata messages.,,,,,,,
0475-suricata_rules.xml,86601,3,,Suricata: Alert - $(alert.signature),,,86600,,,,
0475-suricata_rules.xml,86602,0,,Suricata: HTTP.,,,86600,,,,
0475-suricata_rules.xml,86603,0,,Suricata: DNS.,,,86600,,,,
0475-suricata_rules.xml,86604,0,,Suricata: TLS.,,,86600,,,,
0480-qualysguard_rules.xml,86900,0,,Qualysguard messages grouped.,,,,,,,
0480-qualysguard_rules.xml,86901,3,,Qualysguard: $(qualysguard.vulnerability_title).,"pci_dss_10.6.1,gdpr_IV_35.7.d,",,86900,,,,
0480-qualysguard_rules.xml,86902,7,,Qualysguard: $(qualysguard.vulnerability_title).,"pci_dss_10.6.1,gdpr_IV_35.7.d,",,86900,,,,
0480-qualysguard_rules.xml,86903,4,,Qualysguard: $(qualysguard.vulnerability_title).,"pci_dss_10.6.1,gdpr_IV_35.7.d,",,86900,,,,
0480-qualysguard_rules.xml,86904,8,,Qualysguard: $(qualysguard.vulnerability_title).,"pci_dss_10.6.1,gdpr_IV_35.7.d,",,86900,,,,
0480-qualysguard_rules.xml,86905,5,,Qualysguard: $(qualysguard.vulnerability_title).,"pci_dss_10.6.1,gdpr_IV_35.7.d,",,86900,,,,
0480-qualysguard_rules.xml,86906,10,,Qualysguard: $(qualysguard.vulnerability_title).,"pci_dss_10.6.1,gdpr_IV_35.7.d,",,86900,,,,
0485-cylance_rules.xml,87000,0,,Cylance events messages grouped.,,,,,,,
0485-cylance_rules.xml,87001,5,,Cylance: File $(cylance_events.filepath) is unsafe.,"pci_dss_10.6.1,gdpr_IV_35.7.d,",T1203,87000,,,,
0485-cylance_rules.xml,87002,4,,Cylance: File $(cylance_events.filepath) is abnormal.,,T1203,87000,,,,
