File_Name,Rule_ID,Level,Match,Description,Groups,MITRE_ID,If_Sid,If_Matched_Sid,Frequency,Timeframe,Ignore
0750-github_rules.xml,91129,3,,GitHub Dependency graph new repos.,git_dependency_graph_new_repos,,91100,,,,
0750-github_rules.xml,91130,12,,GitHub Dependency graph new repos disable.,git_dependency_graph_new_repos,,91129,,,,
0750-github_rules.xml,91131,3,,GitHub Dependency graph new repos enable.,git_dependency_graph_new_repos,,91129,,,,
0750-github_rules.xml,91132,3,,GitHub Discussion post.,git_discussion_post,,91100,,,,
0750-github_rules.xml,91133,5,,GitHub Discussion post update.,git_discussion_post,,91132,,,,
0750-github_rules.xml,91134,5,,GitHub Discussion post destroy.,git_discussion_post,,91132,,,,
0750-github_rules.xml,91135,3,,GitHub Discussion post reply.,git_discussion_post_reply,,91100,,,,
0750-github_rules.xml,91136,5,,GitHub Discussion post replay update.,git_discussion_post_reply,,91135,,,,
0750-github_rules.xml,91137,5,,GitHub Discussion post replay destroy.,git_discussion_post_reply,,91135,,,,
0750-github_rules.xml,91139,3,,GitHub Enterprise.,git_enterprise,,91100,,,,
0750-github_rules.xml,91140,3,,GitHub Enterprise Remove self hosted runner.,git_enterprise,,91139,,,,
0750-github_rules.xml,91141,3,,GitHub Enterprise Register self hosted runner.,git_enterprise,,91139,,,,
0750-github_rules.xml,91142,5,,GitHub Enterprise Runner group created.,git_enterprise,,91139,,,,
0750-github_rules.xml,91143,7,,GitHub Enterprise Runner group removed.,git_enterprise,,91139,,,,
0750-github_rules.xml,91144,7,,GitHub Enterprise Runner group runner removed.,git_enterprise,,91139,,,,
0750-github_rules.xml,91145,5,,GitHub Enterprise Runner group runners added.,git_enterprise,,91139,,,,
0750-github_rules.xml,91146,5,,GitHub Enterprise Runner group runners updated.,git_enterprise,,91139,,,,
0750-github_rules.xml,91147,5,,GitHub Enterprise Runner group updated.,git_enterprise,,91139,,,,
0750-github_rules.xml,91148,3,,GitHub Enterprise Self hosted runner updated.,git_enterprise,,91139,,,,
0750-github_rules.xml,91149,3,,GitHub Environment.,git_environment,,91100,,,,
0750-github_rules.xml,91150,7,,GitHub Environment Create actions secret.,git_environment,,91149,,,,
0750-github_rules.xml,91151,7,,GitHub Environment Delete.,git_environment,,91149,,,,
0750-github_rules.xml,91152,9,,GitHub Environment Remove actions secret.,git_environment,,91149,,,,
0750-github_rules.xml,91153,7,,GitHub Environment Update actions secret.,git_environment,,91149,,,,
0750-github_rules.xml,91154,7,,GitHub Environment Add protection rule.,git_environment,,91149,,,,
0750-github_rules.xml,91155,7,,GitHub Environment Update protection rule.,git_environment,,91149,,,,
0750-github_rules.xml,91156,9,,GitHub Environment Remove protection rule.,git_environment,,91149,,,,
0750-github_rules.xml,91157,3,,GitHub Git.,git_git,,91100,,,,
0750-github_rules.xml,91158,3,,GitHub Git clone.,git_git,,91157,,,,
0750-github_rules.xml,91159,3,,GitHub Git fetch.,git_git,,91157,,,,
0750-github_rules.xml,91160,3,,GitHub Git push.,git_git,,91157,,,,
0750-github_rules.xml,91161,3,,GitHub Hook.,git_hook,,91100,,,,
0750-github_rules.xml,91162,5,,GitHub Hook create.,git_hook,,91161,,,,
0750-github_rules.xml,91163,5,,GitHub Hook config changed.,git_hook,,91161,,,,
0750-github_rules.xml,91164,7,,GitHub Hook destroy.,git_hook,,91161,,,,
0750-github_rules.xml,91165,5,,GitHub Hook events changed.,git_hook,,91161,,,,
0750-github_rules.xml,91166,3,,GitHub Integration installation.,git_integration_installation,,91100,,,,
0750-github_rules.xml,91167,5,,GitHub Integration installation create.,git_integration_installation,,91166,,,,
0750-github_rules.xml,91168,5,,GitHub Integration installation close.,git_integration_installation,,91166,,,,
0750-github_rules.xml,91169,3,,GitHub Issues.,git_issues,,91100,,,,
0750-github_rules.xml,91170,5,,GitHub Issues destroy.,git_issues,,91169,,,,
0750-github_rules.xml,91171,3,,GitHub Marketplace agreement signature.,git_issues,,91100,,,,
0750-github_rules.xml,91172,7,,GitHub Marketplace agreement signature create.,git_issues,,91171,,,,
0750-github_rules.xml,91173,3,,GitHub Marketplace listing.,git_marketplace_listing,,91100,,,,
0750-github_rules.xml,91174,5,,GitHub Marketplace listing approve.,git_marketplace_listing,,91173,,,,
0750-github_rules.xml,91175,5,,GitHub Marketplace listing create.,git_marketplace_listing,,91173,,,,
0750-github_rules.xml,91176,5,,GitHub Marketplace listing delist.,git_marketplace_listing,,91173,,,,
0750-github_rules.xml,91177,5,,GitHub Marketplace listing redraft.,git_marketplace_listing,,91173,,,,
0750-github_rules.xml,91178,5,,GitHub Marketplace listing reject.,git_marketplace_listing,,91173,,,,
0750-github_rules.xml,91179,3,,GitHub Members can create pages.,git_members_can_create_pages,,91100,,,,
0750-github_rules.xml,91180,3,,GitHub Members can create pages enable.,git_members_can_create_pages,,91179,,,,
0750-github_rules.xml,91181,3,,GitHub Members can create pages disable.,git_members_can_create_pages,,91179,,,,
0750-github_rules.xml,91182,3,,GitHub Oauth application.,git_oauth_application,,91100,,,,
0750-github_rules.xml,91183,5,,GitHub Oauth application create.,git_oauth_application,,91182,,,,
0750-github_rules.xml,91184,7,,GitHub Oauth application destroy.,git_oauth_application,,91182,,,,
0750-github_rules.xml,91185,7,,GitHub Oauth application reset secret.,git_oauth_application,,91182,,,,
0750-github_rules.xml,91186,7,,GitHub Oauth application revoke tokens.,git_oauth_application,,91182,,,,
0750-github_rules.xml,91187,5,,GitHub Oauth application transfer.,git_oauth_application,,91182,,,,
0750-github_rules.xml,91188,3,,GitHub Organization.,git_org,,91100,,,,
0750-github_rules.xml,91189,9,,GitHub Organization add billing manager.,git_org,,91188,,,,
0750-github_rules.xml,91190,5,,GitHub Organization add member.,git_org,,91188,,,,
0750-github_rules.xml,91191,9,,GitHub Organization advanced security policy selected member disabled.,git_org,,91188,,,,
0750-github_rules.xml,91192,5,,GitHub Organization advanced security policy selected member enabled.,git_org,,91188,,,,
0750-github_rules.xml,91193,5,,GitHub Organization audit log export.,git_org,,91188,,,,
0750-github_rules.xml,91194,9,,GitHub Organization block user.,git_org,,91188,,,,
0750-github_rules.xml,91195,5,,GitHub Organization cancel invitation.,git_org,,91188,,,,
0750-github_rules.xml,91196,5,,GitHub Organization create.,git_org,,91188,,,,
0750-github_rules.xml,91197,7,,GitHub Organization create actions secret.,git_org,,91188,,,,
0750-github_rules.xml,91198,9,,GitHub Organization disable member team creation permission.,git_org,,91188,,,,
0750-github_rules.xml,91199,12,,GitHub Organization disable oauth app restrictions.,git_org,,91188,,,,
0750-github_rules.xml,91200,12,,GitHub Organization disable saml.,git_org,,91188,,,,
0750-github_rules.xml,91201,12,,GitHub Organization disable two factor requirement.,git_org,,91188,,,,
0750-github_rules.xml,91202,5,,GitHub Organization display commenter full name enabled.,git_org,,91188,,,,
0750-github_rules.xml,91203,5,,GitHub Organization enable member team creation permission.,git_org,,91188,,,,
0750-github_rules.xml,91204,7,,GitHub Organization enable oauth app restrictions.,git_org,,91188,,,,
0750-github_rules.xml,91205,7,,GitHub Organization enable saml.,git_org,,91188,,,,
0750-github_rules.xml,91206,7,,GitHub Organization enable two factor requirement.,git_org,,91188,,,,
0750-github_rules.xml,91207,5,,GitHub Organization invite member.,git_org,,91188,,,,
0750-github_rules.xml,91208,7,,GitHub Organization oauth app access approved.,git_org,,91188,,,,
0750-github_rules.xml,91209,12,,GitHub Organization oauth app access denied.,git_org,,91188,,,,
0750-github_rules.xml,91210,7,,GitHub Organization oauth app access requested.,git_org,,91188,,,,
0750-github_rules.xml,91211,3,,GitHub Organization register self hosted runner.,git_org,,91188,,,,
0750-github_rules.xml,91212,9,,GitHub Organization remove actions secret.,git_org,,91188,,,,
0750-github_rules.xml,91213,9,,GitHub Organization remove billing manager.,git_org,,91188,,,,
0750-github_rules.xml,91214,7,,GitHub Organization remove member.,git_org,,91188,,,,
0750-github_rules.xml,91215,7,,GitHub Organization remove outside collaborator.,git_org,,91188,,,,
0750-github_rules.xml,91216,3,,GitHub Organization remove self hosted runner.,git_org,,91188,,,,
0750-github_rules.xml,91217,5,,GitHub Organization restore member.,git_org,,91188,,,,
0750-github_rules.xml,91218,9,,GitHub Organization revoke external identity.,git_org,,91188,,,,
0750-github_rules.xml,91219,9,,GitHub Organization revoke sso session.,git_org,,91188,,,,
0750-github_rules.xml,91220,5,,GitHub Organization runner group created.,git_org,,91188,,,,
0750-github_rules.xml,91221,7,,GitHub Organization runner group removed.,git_org,,91188,,,,
0750-github_rules.xml,91222,7,,GitHub Organization runner group runner removed.,git_org,,91188,,,,
0750-github_rules.xml,91223,5,,GitHub Organization runner group runners added.,git_org,,91188,,,,
0750-github_rules.xml,91224,5,,GitHub Organization runner group runners updated.,git_org,,91188,,,,
0750-github_rules.xml,91225,5,,GitHub Organization runner group updated.,git_org,,91188,,,,
0750-github_rules.xml,91226,3,,GitHub Organization self hosted runner updated.,git_org,,91188,,,,
0750-github_rules.xml,91227,5,,GitHub Organization set actions retention limit.,git_org,,91188,,,,
0750-github_rules.xml,91228,7,,GitHub Organization unblock user.,git_org,,91188,,,,
0750-github_rules.xml,91229,7,,GitHub Organization update actions secret.,git_org,,91188,,,,
0750-github_rules.xml,91230,7,,GitHub Organization update actions settings.,git_org,,91188,,,,
0750-github_rules.xml,91231,7,,GitHub Organization update default repository permission.,git_org,,91188,,,,
0750-github_rules.xml,91232,5,,GitHub Organization update member.,git_org,,91188,,,,
0750-github_rules.xml,91233,7,,GitHub Organization update member repository creation permission.,git_org,,91188,,,,
0750-github_rules.xml,91234,7,,GitHub Organization update new repository default branch setting.,git_org,,91188,,,,
0750-github_rules.xml,91235,7,,GitHub Organization update saml provider settings.,git_org,,91188,,,,
0750-github_rules.xml,91236,7,,GitHub Organization update terms of service.,git_org,,91188,,,,
0750-github_rules.xml,91239,3,,GitHub Organization credential authorization.,git_org_credential_authorization,,91100,,,,
0750-github_rules.xml,91240,7,,GitHub Organization credential authorization grant.,git_org_credential_authorization,,91239,,,,
0750-github_rules.xml,91241,12,,GitHub Organization credential authorization deauthorized.,git_org_credential_authorization,,91239,,,,
0750-github_rules.xml,91242,9,,GitHub Organization credential authorization revoke.,git_org_credential_authorization,,91239,,,,
0750-github_rules.xml,91243,3,,GitHub Organization default label.,git_organization_default_label,,91100,,,,
0750-github_rules.xml,91244,5,,GitHub Organization default label create.,git_organization_default_label,,91243,,,,
0750-github_rules.xml,91245,5,,GitHub Organization default label update.,git_organization_default_label,,91243,,,,
0750-github_rules.xml,91246,5,,GitHub Organization default label destroy.,git_organization_default_label,,91243,,,,
0750-github_rules.xml,91247,3,,GitHub Packages.,git_packages,,91100,,,,
0750-github_rules.xml,91248,5,,GitHub Package version published.,git_packages,,91247,,,,
0750-github_rules.xml,91249,7,,GitHub Package version deleted.,git_packages,,91247,,,,
0750-github_rules.xml,91250,7,,GitHub Package deleted.,git_packages,,91247,,,,
0750-github_rules.xml,91251,5,,GitHub Package version restored.,git_packages,,91247,,,,
0750-github_rules.xml,91252,5,,GitHub Package restored.,git_packages,,91247,,,,
0750-github_rules.xml,91253,3,,GitHub Payment method.,git_payment_method,,91100,,,,
0750-github_rules.xml,91254,7,,GitHub Payment method clear.,git_payment_method,,91253,,,,
0750-github_rules.xml,91255,7,,GitHub Payment method create.,git_payment_method,,91253,,,,
0750-github_rules.xml,91256,7,,GitHub Payment method update.,git_payment_method,,91253,,,,
0750-github_rules.xml,91257,3,,GitHub Profile picture.,git_profile_picture,,91100,,,,
0750-github_rules.xml,91258,5,,GitHub Profile picture update.,git_profile_picture,,91257,,,,
0750-github_rules.xml,91259,3,,GitHub Project.,git_project,,91100,,,,
0750-github_rules.xml,91260,5,,GitHub Project create.,git_project,,91259,,,,
0750-github_rules.xml,91261,5,,GitHub Project link.,git_project,,91259,,,,
0750-github_rules.xml,91262,5,,GitHub Project rename.,git_project,,91259,,,,
0750-github_rules.xml,91263,5,,GitHub Project update.,git_project,,91259,,,,
0750-github_rules.xml,91264,7,,GitHub Project delete.,git_project,,91259,,,,
0750-github_rules.xml,91265,7,,GitHub Project unlink.,git_project,,91259,,,,
0750-github_rules.xml,91266,5,,GitHub Project update org permission.,git_project,,91259,,,,
0750-github_rules.xml,91267,5,,GitHub Project update team permission.,git_project,,91259,,,,
0750-github_rules.xml,91268,5,,GitHub Project update user permission.,git_project,,91259,,,,
0750-github_rules.xml,91269,3,,GitHub Organization domain.,git_organization_domain,,91100,,,,
0750-github_rules.xml,91270,5,,GitHub Organization domain create.,git_organization_domain,,91269,,,,
0750-github_rules.xml,91271,5,,GitHub Organization domain delete.,git_organization_domain,,91269,,,,
0750-github_rules.xml,91272,3,,GitHub Private repository forking.,git_private_repository_forking,,91100,,,,
0750-github_rules.xml,91273,9,,GitHub Private repository forking enable.,git_private_repository_forking,,91272,,,,
0750-github_rules.xml,91274,5,,GitHub Private repository forking disable.,git_private_repository_forking,,91272,,,,
0750-github_rules.xml,91275,3,,GitHub Protected branch.,git_protected_branch,,91100,,,,
0750-github_rules.xml,91276,5,,GitHub Protected branch create.,git_protected_branch,,91275,,,,
0750-github_rules.xml,91277,7,,GitHub Protected branch destroy.,git_protected_branch,,91275,,,,
0750-github_rules.xml,91278,5,,GitHub Protected branch update admin enforced.,git_protected_branch,,91275,,,,
0750-github_rules.xml,91279,5,,GitHub Protected branch update require code owner review.,git_protected_branch,,91275,,,,
0750-github_rules.xml,91280,5,,GitHub Protected branch dismissal restricted users teams.,git_protected_branch,,91275,,,,
0750-github_rules.xml,91281,5,,GitHub Protected branch dismiss stale reviews.,git_protected_branch,,91275,,,,
0750-github_rules.xml,91282,5,,GitHub Protected branch update signature requirement enforcement level.,git_protected_branch,,91275,,,,
0750-github_rules.xml,91283,5,,GitHub Protected branch update pull request reviews enforcement level.,git_protected_branch,,91275,,,,
0750-github_rules.xml,91284,5,,GitHub Protected branch update required status checks enforcement level.,git_protected_branch,,91275,,,,
0750-github_rules.xml,91285,5,,GitHub Protected branch update strict required status checks policy.,git_protected_branch,,91275,,,,
0750-github_rules.xml,91286,5,,GitHub Protected branch rejected ref update.,git_protected_branch,,91275,,,,
0750-github_rules.xml,91287,5,,GitHub Protected branch policy override.,git_protected_branch,,91275,,,,
0750-github_rules.xml,91288,5,,GitHub Protected branch update allow force pushes enforcement level.,git_protected_branch,,91275,,,,
0750-github_rules.xml,91289,5,,GitHub Protected branch update allow deletions enforcement level.,git_protected_branch,,91275,,,,
0750-github_rules.xml,91290,5,,GitHub Protected branch update linear history requirement enforcement level.,git_protected_branch,,91275,,,,
0750-github_rules.xml,91292,3,,GitHub Pull request.,git_pull_request,,91100,,,,
0750-github_rules.xml,91293,5,,GitHub Pull request create.,git_pull_request,,91292,,,,
0750-github_rules.xml,91294,5,,GitHub Pull request close.,git_pull_request,,91292,,,,
0750-github_rules.xml,91295,5,,GitHub Pull request reopen.,git_pull_request,,91292,,,,
0750-github_rules.xml,91296,5,,GitHub Pull request merge.,git_pull_request,,91292,,,,
0750-github_rules.xml,91297,5,,GitHub Pull request indirect merge.,git_pull_request,,91292,,,,
0750-github_rules.xml,91298,5,,GitHub Pull request ready for review.,git_pull_request,,91292,,,,
0750-github_rules.xml,91299,5,,GitHub Pull request converted to draft.,git_pull_request,,91292,,,,
0750-github_rules.xml,91300,5,,GitHub Pull request create review request.,git_pull_request,,91292,,,,
0750-github_rules.xml,91301,5,,GitHub Pull request remove review request.,git_pull_request,,91292,,,,
0750-github_rules.xml,91302,3,,GitHub Pull request review.,git_pull_request_review,,91100,,,,
0750-github_rules.xml,91303,5,,GitHub Pull request review submit.,git_pull_request_review,,91302,,,,
0750-github_rules.xml,91304,5,,GitHub Pull request review dismiss.,git_pull_request_review,,91302,,,,
0750-github_rules.xml,91305,5,,GitHub Pull request review delete.,git_pull_request_review,,91302,,,,
0750-github_rules.xml,91306,3,,GitHub Pull request review comment.,git_pull_request_review_comment,,91100,,,,
0750-github_rules.xml,91307,5,,GitHub Pull request review comment create.,git_pull_request_review_comment,,91306,,,,
0750-github_rules.xml,91308,5,,GitHub Pull request review comment update.,git_pull_request_review_comment,,91306,,,,
0750-github_rules.xml,91309,5,,GitHub Pull request review comment delete.,git_pull_request_review_comment,,91306,,,,
0750-github_rules.xml,91310,3,,GitHub Repo.,git_repo,,91100,,,,
0750-github_rules.xml,91311,7,,GitHub Repo access.,git_repo,,91310,,,,
0750-github_rules.xml,91312,5,,GitHub Repo actions enabled.,git_repo,,91310,,,,
0750-github_rules.xml,91313,5,,GitHub Repo add member.,git_repo,,91310,,,,
0750-github_rules.xml,91314,5,,GitHub Repo add topic.,git_repo,,91310,,,,
0750-github_rules.xml,91315,12,,GitHub Repo advanced security disabled.,git_repo,,91310,,,,
0750-github_rules.xml,91316,7,,GitHub Repo advanced security enabled.,git_repo,,91310,,,,
0750-github_rules.xml,91317,9,,GitHub Repo archived.,git_repo,,91310,,,,
0750-github_rules.xml,91318,5,,GitHub Repo create.,git_repo,,91310,,,,
0750-github_rules.xml,91319,7,,GitHub Repo create actions secret.,git_repo,,91310,,,,
0750-github_rules.xml,91320,9,,GitHub Repo destroy.,git_repo,,91310,,,,
0750-github_rules.xml,91321,9,,GitHub Repo disable.,git_repo,,91310,,,,
0750-github_rules.xml,91322,5,,GitHub Repo enable.,git_repo,,91310,,,,
0750-github_rules.xml,91323,5,,GitHub Repo pages create.,git_repo,,91310,,,,
0750-github_rules.xml,91324,5,,GitHub Repo pages https redirect enabled.,git_repo,,91310,,,,
0750-github_rules.xml,91325,5,,GitHub Repo pages private.,git_repo,,91310,,,,
0750-github_rules.xml,91326,5,,GitHub Repo pages public.,git_repo,,91310,,,,
0750-github_rules.xml,91327,5,,GitHub Repo pages source.,git_repo,,91310,,,,
0750-github_rules.xml,91328,9,,GitHub Repo remove actions secret.,git_repo,,91310,,,,
0750-github_rules.xml,91329,7,,GitHub Repo remove member.,git_repo,,91310,,,,
0750-github_rules.xml,91330,3,,GitHub Repo register self hosted runner.,git_repo,,91310,,,,
0750-github_rules.xml,91331,3,,GitHub Repo remove self hosted runner.,git_repo,,91310,,,,
0750-github_rules.xml,91332,5,,GitHub Repo remove topic.,git_repo,,91310,,,,
0750-github_rules.xml,91333,5,,GitHub Repo rename.,git_repo,,91310,,,,
0750-github_rules.xml,91334,3,,GitHub Repo self hosted runner updated.,git_repo,,91310,,,,
0750-github_rules.xml,91335,5,,GitHub Repo set actions retention limit.,git_repo,,91310,,,,
0750-github_rules.xml,91336,5,,GitHub Repo transfer.,git_repo,,91310,,,,
0750-github_rules.xml,91337,5,,GitHub Repo transfer start.,git_repo,,91310,,,,
0750-github_rules.xml,91338,5,,GitHub Repo unarchived.,git_repo,,91310,,,,
0750-github_rules.xml,91339,7,,GitHub Repo update actions secret.,git_repo,,91310,,,,
0750-github_rules.xml,91340,3,,GitHub Repository advisory.,git_repository_advisory,,91100,,,,
0750-github_rules.xml,91341,7,,GitHub Repository advisory close.,git_repository_advisory,,91340,,,,
0750-github_rules.xml,91342,9,,GitHub Repository advisory cve request.,git_repository_advisory,,91340,,,,
0750-github_rules.xml,91343,9,,GitHub Repository advisory github broadcast.,git_repository_advisory,,91340,,,,
0750-github_rules.xml,91344,9,,GitHub Repository advisory github withdraw.,git_repository_advisory,,91340,,,,
0750-github_rules.xml,91345,7,,GitHub Repository advisory open.,git_repository_advisory,,91340,,,,
0750-github_rules.xml,91346,7,,GitHub Repository advisory publish.,git_repository_advisory,,91340,,,,
0750-github_rules.xml,91347,7,,GitHub Repository advisory reopen.,git_repository_advisory,,91340,,,,
0750-github_rules.xml,91348,7,,GitHub Repository advisory update.,git_repository_advisory,,91340,,,,
0750-github_rules.xml,91349,3,,GitHub Repository content analysis.,git_repository_content_analysis,,91100,,,,
0750-github_rules.xml,91350,5,,GitHub Repository content analysis enable.,git_repository_content_analysis,,91349,,,,
0750-github_rules.xml,91351,9,,GitHub Repository content analysis disable.,git_repository_content_analysis,,91349,,,,
0750-github_rules.xml,91352,3,,GitHub Repository dependency graph.,git_repository_dependency_graph,,91100,,,,
0750-github_rules.xml,91353,9,,GitHub Repository dependency graph disable.,git_repository_dependency_graph,,91352,,,,
0750-github_rules.xml,91354,5,,GitHub Repository dependency graph enable.,git_repository_dependency_graph,,91352,,,,
0750-github_rules.xml,91355,3,,GitHub Repository projects change.,git_repository_projects_change,,91100,,,,
0750-github_rules.xml,91356,9,,GitHub Repository projects change disable.,git_repository_projects_change,,91355,,,,
0750-github_rules.xml,91357,5,,GitHub Repository projects change enable.,git_repository_projects_change,,91355,,,,
0750-github_rules.xml,91358,3,,GitHub Repository secret scanning.,git_repository_secret_scanning,,91100,,,,
0750-github_rules.xml,91359,9,,GitHub Repository secret scanning disable.,git_repository_secret_scanning,,91358,,,,
0750-github_rules.xml,91360,5,,GitHub Repository secret scanning enable.,git_repository_secret_scanning,,91358,,,,
0750-github_rules.xml,91361,3,,GitHub Repository vulnerability alert.,git_repository_vulnerability_alert,,91100,,,,
0750-github_rules.xml,91362,12,,GitHub Repository vulnerability alert create.,git_repository_vulnerability_alert,,91361,,,,
0750-github_rules.xml,91363,9,,GitHub Repository vulnerability alert dismiss.,git_repository_vulnerability_alert,,91361,,,,
0750-github_rules.xml,91364,7,,GitHub Repository vulnerability alert resolve.,git_repository_vulnerability_alert,,91361,,,,
0750-github_rules.xml,91365,3,,GitHub Repository vulnerability alerts.,git_repository_vulnerability_alerts,,91100,,,,
0750-github_rules.xml,91366,7,,GitHub Repository vulnerability alerts authorized users teams.,git_repository_vulnerability_alerts,,91365,,,,
0750-github_rules.xml,91367,12,,GitHub Repository vulnerability alerts disable.,git_repository_vulnerability_alerts,,91365,,,,
0750-github_rules.xml,91368,5,,GitHub Repository vulnerability alerts enable.,git_repository_vulnerability_alerts,,91365,,,,
0750-github_rules.xml,91369,3,,GitHub Secret scanning.,git_secret_scanning,,91100,,,,
0750-github_rules.xml,91370,9,,GitHub Secret scanning disable.,git_secret_scanning,,91369,,,,
0750-github_rules.xml,91371,5,,GitHub Secret scanning enable.,git_secret_scanning,,91369,,,,
0750-github_rules.xml,91372,3,,GitHub Secret scanning new repos.,git_secret_scanning_new_repos,,91100,,,,
0750-github_rules.xml,91373,9,,GitHub Secret scanning new repos disable.,git_secret_scanning_new_repos,,91372,,,,
0750-github_rules.xml,91374,5,,GitHub Secret scanning new repos enable.,git_secret_scanning_new_repos,,91372,,,,
0750-github_rules.xml,91375,3,,GitHub Sponsors.,git_sponsors,,91100,,,,
0750-github_rules.xml,91376,5,,GitHub Sponsors custom amount settings change.,git_sponsors,,91375,,,,
0750-github_rules.xml,91377,5,,GitHub Sponsors repo funding links file action.,git_sponsors,,91375,,,,
0750-github_rules.xml,91378,5,,GitHub Sponsors sponsorship cancel.,git_sponsors,,91375,,,,
0750-github_rules.xml,91379,5,,GitHub Sponsors sponsorship create.,git_sponsors,,91375,,,,
0750-github_rules.xml,91380,5,,GitHub Sponsors sponsorship preference change.,git_sponsors,,91375,,,,
0750-github_rules.xml,91381,5,,GitHub Sponsors sponsorship tier change.,git_sponsors,,91375,,,,
0750-github_rules.xml,91382,5,,GitHub Sponsors sponsored developer approve.,git_sponsors,,91375,,,,
0750-github_rules.xml,91383,5,,GitHub Sponsors sponsored developer create.,git_sponsors,,91375,,,,
0750-github_rules.xml,91384,5,,GitHub Sponsors sponsored developer disable.,git_sponsors,,91375,,,,
0750-github_rules.xml,91385,5,,GitHub Sponsors sponsored developer redraft.,git_sponsors,,91375,,,,
0750-github_rules.xml,91386,5,,GitHub Sponsors sponsored developer profile update.,git_sponsors,,91375,,,,
0750-github_rules.xml,91387,5,,GitHub Sponsors sponsored developer request approval.,git_sponsors,,91375,,,,
0750-github_rules.xml,91388,5,,GitHub Sponsors sponsored developer tier description update.,git_sponsors,,91375,,,,
0750-github_rules.xml,91389,5,,GitHub Sponsors sponsored developer update newsletter send.,git_sponsors,,91375,,,,
0750-github_rules.xml,91390,5,,GitHub Sponsors waitlist invite sponsored developer.,git_sponsors,,91375,,,,
0750-github_rules.xml,91391,5,,GitHub Sponsors waitlist join.,git_sponsors,,91375,,,,
0750-github_rules.xml,91392,3,,GitHub Team.,git_team,,91100,,,,
0750-github_rules.xml,91393,5,,GitHub Team add member.,git_team,,91392,,,,
0750-github_rules.xml,91394,5,,GitHub Team add repository.,git_team,,91392,,,,
0750-github_rules.xml,91395,7,,GitHub Team change parent team.,git_team,,91392,,,,
0750-github_rules.xml,91396,7,,GitHub Team change privacy.,git_team,,91392,,,,
0750-github_rules.xml,91397,5,,GitHub Team create.,git_team,,91392,,,,
0750-github_rules.xml,91398,7,,GitHub Team demote maintainer.,git_team,,91392,,,,
0750-github_rules.xml,91399,7,,GitHub Team destroy.,git_team,,91392,,,,
